question_id,question,answer1_id,answer1,answer2_id,answer2
01502137e4276712d118bd4bdaf481c89aed163b, who is the manager that gets micky away from his family of bad influence and encourages him back into the ring? ,01502137e4276712d118bd4bdaf481c89aed163b, micky is lured back into boxing by his father who believes alice and his stepson dicky are bad influences. ,01502137e4276712d118bd4bdaf481c89aed163b, micky is lured back into boxing by his father  who believes alice and his stepson dicky are bad influences. 
01502137e4276712d118bd4bdaf481c89aed163b," ""during his series of fights to regain his career ",01502137e4276712d118bd4bdaf481c89aed163b, they place micky in minor fights to help him regain his confidence. ,01502137e4276712d118bd4bdaf481c89aed163b, they place micky in minor fights to help him regain his confidence. 
01502137e4276712d118bd4bdaf481c89aed163b, which member of micky's family realize that other members of the family are bad influences? ,01502137e4276712d118bd4bdaf481c89aed163b, despite micky's reservations his mother and brother agree so that they can all get the purse and micky is defeated. ,01502137e4276712d118bd4bdaf481c89aed163b, micky is lured back into boxing by his father who believes alice and his stepson dicky are bad influences. 
01502137e4276712d118bd4bdaf481c89aed163b, who does dicky seek out to work with in reuniting the family? ,01502137e4276712d118bd4bdaf481c89aed163b, micky washes his hands of dicky. ,01502137e4276712d118bd4bdaf481c89aed163b, micky washes his hands of dicky. 
01502137e4276712d118bd4bdaf481c89aed163b, in what location does the group go for the final title fight? ,01502137e4276712d118bd4bdaf481c89aed163b, after bringing everyone back together  the group goes to london for the title fight. ,01502137e4276712d118bd4bdaf481c89aed163b, after bringing everyone back together the group goes to london for the title fight. 
01502137e4276712d118bd4bdaf481c89aed163b, what reward does micky gain in the final victory? ,01502137e4276712d118bd4bdaf481c89aed163b, micky scores another upset victory and the welterweight title. ,01502137e4276712d118bd4bdaf481c89aed163b, micky scores another upset victory and the welterweight title. 
01502137e4276712d118bd4bdaf481c89aed163b, what is charlene fleming's current occupation? ,01502137e4276712d118bd4bdaf481c89aed163b, micky retreats from the world and forms a relationship with charlene fleming  a former college athlete who dropped out and became a bartender. ,01502137e4276712d118bd4bdaf481c89aed163b, micky retreats from the world and forms a relationship with charlene fleming a former college athlete who dropped out and became a bartender. 
01502137e4276712d118bd4bdaf481c89aed163b, how much heavier than micky is micky's opponent in atlantic city? ,01502137e4276712d118bd4bdaf481c89aed163b, valid on the night of an undercard fight in atlantic city micky's scheduled opponent is ill and a substitute is found who is 20 pounds heavier than micky a huge difference in professional boxing constituting two or three weight classes. ,01502137e4276712d118bd4bdaf481c89aed163b, the film jumps a few years ahead with dicky crediting his brother as the creator of his own success.on the night of an undercard fight in atlantic city  micky s scheduled opponent is ill  and a substitute is found who is 20 pounds heavier than micky  a huge difference in professional boxing  constituting two or three weight classes. 
01502137e4276712d118bd4bdaf481c89aed163b, why do micky and his family agree to the fight in atlantic city? ,01502137e4276712d118bd4bdaf481c89aed163b, despite micky s reservations  his mother and brother agree so that they can all get the purse and micky is defeated. ,01502137e4276712d118bd4bdaf481c89aed163b, after several weeks alice arranges another fight for micky concerned it will turn out the same. 
01502137e4276712d118bd4bdaf481c89aed163b, what does dicky have his girlfriend pose as? ,01502137e4276712d118bd4bdaf481c89aed163b, micky washes his hands of dicky. ,01502137e4276712d118bd4bdaf481c89aed163b, micky washes his hands of dicky. 
01502137e4276712d118bd4bdaf481c89aed163b, who does micky accuse of favoring dicky? ,01502137e4276712d118bd4bdaf481c89aed163b, micky and dicky spar until micky knocks dicky down. ,01502137e4276712d118bd4bdaf481c89aed163b, micky and dicky spar until micky knocks dicky down. 
01502137e4276712d118bd4bdaf481c89aed163b, where does micky's last fight occur? ,01502137e4276712d118bd4bdaf481c89aed163b, despite micky's reservations his mother and brother agree so that they can all get the purse and micky is defeated. ,01502137e4276712d118bd4bdaf481c89aed163b, after bringing everyone back together  the group goes to london for the title fight. 
01502137e4276712d118bd4bdaf481c89aed163b, what happens to dicky when he poses as a policeman? ,01502137e4276712d118bd4bdaf481c89aed163b, micky washes his hands of dicky. ,01502137e4276712d118bd4bdaf481c89aed163b, micky washes his hands of dicky. 
01502137e4276712d118bd4bdaf481c89aed163b, what title does micky finally win? ,01502137e4276712d118bd4bdaf481c89aed163b, micky scores another upset victory and the welterweight title. ,01502137e4276712d118bd4bdaf481c89aed163b, micky scores another upset victory and the welterweight title. 
01502137e4276712d118bd4bdaf481c89aed163b, who suffers from a crack addiction? ,01502137e4276712d118bd4bdaf481c89aed163b, on the night of the hbo documentary's airing dicky's family and dicky himself in prison are horrified to see it is called crack in america how crack addiction ruined dicky's career and life. ,01502137e4276712d118bd4bdaf481c89aed163b, on the night of the hbo documentary s airing  dicky s family  and dicky himself in prison  are horrified to see it is called crack in america how crack addiction ruined dicky s career and life. 
01502137e4276712d118bd4bdaf481c89aed163b, what criminal crime did dickey commit that caused him to get arrested ? ,3d20c51d711c74ec6eedf15e7550f70ed6d17e6f, he was the cause of most of the voices  but he claims that he did not tell theodore to commit the murders. ,3d20c51d711c74ec6eedf15e7550f70ed6d17e6f, he was the cause of most of the voices but he claims that he did not tell theodore to commit the murders. 
01502137e4276712d118bd4bdaf481c89aed163b, how did mickey break his hand? ,01502137e4276712d118bd4bdaf481c89aed163b, micky washes his hands of dicky. ,01502137e4276712d118bd4bdaf481c89aed163b, micky washes his hands of dicky. 
01502137e4276712d118bd4bdaf481c89aed163b, what did sal lanano convicence mickey that he must do in order to return to boxing? ,01502137e4276712d118bd4bdaf481c89aed163b, the other members of his training team and a new manager  sal lanano  persuade micky to return to boxing with the explicit understanding that his mother and brother will no longer be involved. ,01502137e4276712d118bd4bdaf481c89aed163b, the other members of his training team and a new manager sal lanano persuade micky to return to boxing with the explicit understanding that his mother and brother will no longer be involved. 
01502137e4276712d118bd4bdaf481c89aed163b, what was the title of the hbo documentary about dickey? ,01502137e4276712d118bd4bdaf481c89aed163b, after bringing everyone back together  the group goes to london for the title fight. ,01502137e4276712d118bd4bdaf481c89aed163b, after bringing everyone back together the group goes to london for the title fight. 
01502137e4276712d118bd4bdaf481c89aed163b, why did mickey have reservations about his fight in atlantic city ? ,01502137e4276712d118bd4bdaf481c89aed163b, despite micky's reservations his mother and brother agree so that they can all get the purse and micky is defeated. ,01502137e4276712d118bd4bdaf481c89aed163b, valid on the night of an undercard fight in atlantic city micky's scheduled opponent is ill and a substitute is found who is 20 pounds heavier than micky a huge difference in professional boxing constituting two or three weight classes. 
01502137e4276712d118bd4bdaf481c89aed163b, where was the final title fight ? ,01502137e4276712d118bd4bdaf481c89aed163b, after bringing everyone back together  the group goes to london for the title fight. ,01502137e4276712d118bd4bdaf481c89aed163b, after bringing everyone back together the group goes to london for the title fight. 
01502137e4276712d118bd4bdaf481c89aed163b, who does mickey credit for his victory in the end? ,01502137e4276712d118bd4bdaf481c89aed163b, micky scores another upset victory and the welterweight title. ,01502137e4276712d118bd4bdaf481c89aed163b, micky scores another upset victory and the welterweight title. 
01502137e4276712d118bd4bdaf481c89aed163b, who wins the sparing match between mickey and dickey? ,19eb3ac68eb7fcdc2164cfe0c635c595fed660d5, mrs. loomis betrays mickey and shoots him as she plans to pin the murders on mickey. ,19eb3ac68eb7fcdc2164cfe0c635c595fed660d5, mrs. loomis betrays mickey and shoots him  as she plans to pin the murders on mickey. 
01502137e4276712d118bd4bdaf481c89aed163b, who leads mickey back to boxing after the hbo documentary is realeases? ,01502137e4276712d118bd4bdaf481c89aed163b, on the night of the hbo documentary's airing dicky's family and dicky himself in prison are horrified to see it is called crack in america how crack addiction ruined dicky's career and life. ,01502137e4276712d118bd4bdaf481c89aed163b, on the night of the hbo documentary s airing  dicky s family  and dicky himself in prison  are horrified to see it is called crack in america how crack addiction ruined dicky s career and life. 
01502137e4276712d118bd4bdaf481c89aed163b, what weight class does mickey become champion of at the end of the story? ,19eb3ac68eb7fcdc2164cfe0c635c595fed660d5, mrs. loomis betrays mickey and shoots him  as she plans to pin the murders on mickey. ,19eb3ac68eb7fcdc2164cfe0c635c595fed660d5, mrs. loomis betrays mickey and shoots him as she plans to pin the murders on mickey. 
015c99b411cef291d31cd5543c7ae957edebe6b4, where is the enterprise ambushed by the scimitar? ,015c99b411cef291d31cd5543c7ae957edebe6b4, the enterprise races back to federation space but is ambushed by the scimitar in the bassen rift which prevents any subspace communications. ,015c99b411cef291d31cd5543c7ae957edebe6b4, the enterprise races back to federation space but is ambushed by the scimitar in the bassen rift  which prevents any subspace communications. 
015c99b411cef291d31cd5543c7ae957edebe6b4, what comes to enterprise's aid? ,015c99b411cef291d31cd5543c7ae957edebe6b4, the enterprise returns to earth for repairs. ,015c99b411cef291d31cd5543c7ae957edebe6b4, the enterprise returns to earth for repairs. 
015c99b411cef291d31cd5543c7ae957edebe6b4, what does shinzon do to the two romulan warbirds? ,015c99b411cef291d31cd5543c7ae957edebe6b4, two romulan warbirds come to the enterprise s aid  as they do not want to be complicit in shinzon s genocidal plans  but shinzon destroys one and disables the other. ,015c99b411cef291d31cd5543c7ae957edebe6b4, two romulan warbirds come to the enterprise's aid as they do not want to be complicit in shinzon's genocidal plans but shinzon destroys one and disables the other. 
015c99b411cef291d31cd5543c7ae957edebe6b4, why does shinzon activate the thalaron weapon? ,015c99b411cef291d31cd5543c7ae957edebe6b4, to assure their mutual destruction  shinzon activates the thalaron weapon. ,015c99b411cef291d31cd5543c7ae957edebe6b4, to assure their mutual destruction shinzon activates the thalaron weapon. 
015c99b411cef291d31cd5543c7ae957edebe6b4, why is shinzon aging rapidly? ,015c99b411cef291d31cd5543c7ae957edebe6b4, dr. crusher discovers that shinzon is aging rapidly due to being a clone and the only possible means to stop it is a transfusion of picard s own blood. ,015c99b411cef291d31cd5543c7ae957edebe6b4, dr. crusher discovers that shinzon is aging rapidly due to being a clone and the only possible means to stop it is a transfusion of picard's own blood. 
015c99b411cef291d31cd5543c7ae957edebe6b4, whose primary weapons were destroyed? ,015c99b411cef291d31cd5543c7ae957edebe6b4, the collision leaves both ships heavily damaged and destroys the scimitar's primary weapons. ,015c99b411cef291d31cd5543c7ae957edebe6b4, the collision leaves both ships heavily damaged and destroys the scimitar s primary weapons. 
015c99b411cef291d31cd5543c7ae957edebe6b4, who kidnaps picard from the enterprise? ,015c99b411cef291d31cd5543c7ae957edebe6b4, shinzon kidnaps picard from the enterprise as well as b 4 having planted the android on the nearby planet to lure picard to romulus. ,015c99b411cef291d31cd5543c7ae957edebe6b4, shinzon kidnaps picard from the enterprise  as well as b 4  having planted the android on the nearby planet to lure picard to romulus. 
015c99b411cef291d31cd5543c7ae957edebe6b4, who is shinzon a clone of? ,015c99b411cef291d31cd5543c7ae957edebe6b4, on arrival  they learn shinzon is a clone of picard  secretly created by romulans to plant a high ranking spy into the federation  but the project was abandoned and shinzon left on remus as a child to die as a slave. ,015c99b411cef291d31cd5543c7ae957edebe6b4, on arrival they learn shinzon is a clone of picard secretly created by romulans to plant a high ranking spy into the federation but the project was abandoned and shinzon left on remus as a child to die as a slave. 
015c99b411cef291d31cd5543c7ae957edebe6b4, why was shinzon created? ,015c99b411cef291d31cd5543c7ae957edebe6b4, on arrival  they learn shinzon is a clone of picard  secretly created by romulans to plant a high ranking spy into the federation  but the project was abandoned and shinzon left on remus as a child to die as a slave. ,015c99b411cef291d31cd5543c7ae957edebe6b4, on arrival they learn shinzon is a clone of picard secretly created by romulans to plant a high ranking spy into the federation but the project was abandoned and shinzon left on remus as a child to die as a slave. 
015c99b411cef291d31cd5543c7ae957edebe6b4, who created shinzon? ,015c99b411cef291d31cd5543c7ae957edebe6b4, on arrival they learn shinzon is a clone of picard secretly created by romulans to plant a high ranking spy into the federation but the project was abandoned and shinzon left on remus as a child to die as a slave. ,015c99b411cef291d31cd5543c7ae957edebe6b4, on arrival  they learn shinzon is a clone of picard  secretly created by romulans to plant a high ranking spy into the federation  but the project was abandoned and shinzon left on remus as a child to die as a slave. 
015c99b411cef291d31cd5543c7ae957edebe6b4, what is the name of the reman rebel leader? ,015c99b411cef291d31cd5543c7ae957edebe6b4, on romulus members of the romulan imperial senate debate whether or not to accept the terms of peace and alliance with the reman rebel leader shinzon. ,015c99b411cef291d31cd5543c7ae957edebe6b4, though b 4 does not yet act as data picard is assured that he will become like his friend in time.on romulus members of the romulan imperial senate debate whether or not to accept the terms of peace and alliance with the reman rebel leader shinzon. 
015c99b411cef291d31cd5543c7ae957edebe6b4, on what planet do will riker and deanna troi plan to marry? ,015c99b411cef291d31cd5543c7ae957edebe6b4, meanwhile the crew of the uss enterprise e prepares to bid farewell to first officer commander william riker and counselor deanna troi who are being married on betazed. ,015c99b411cef291d31cd5543c7ae957edebe6b4, meanwhile  the crew of the uss enterprise e prepares to bid farewell to first officer commander william riker and counselor deanna troi  who are being married on betazed. 
015c99b411cef291d31cd5543c7ae957edebe6b4, what is the name of android that resembles data? ,015c99b411cef291d31cd5543c7ae957edebe6b4, when the android is reassembled it introduces itself as b 4. the crew deduce it to be a less advanced earlier version of data. ,015c99b411cef291d31cd5543c7ae957edebe6b4, when the android is reassembled it introduces itself as b 4. the crew deduce it to be a less advanced  earlier version of data. 
015c99b411cef291d31cd5543c7ae957edebe6b4, who is shinzon a clone of? ,015c99b411cef291d31cd5543c7ae957edebe6b4, on arrival  they learn shinzon is a clone of picard  secretly created by romulans to plant a high ranking spy into the federation  but the project was abandoned and shinzon left on remus as a child to die as a slave. ,015c99b411cef291d31cd5543c7ae957edebe6b4, on arrival they learn shinzon is a clone of picard secretly created by romulans to plant a high ranking spy into the federation but the project was abandoned and shinzon left on remus as a child to die as a slave. 
015c99b411cef291d31cd5543c7ae957edebe6b4, what is the name of shinzon's flagship? ,015c99b411cef291d31cd5543c7ae957edebe6b4, after many years shinzon became a leader of the remans and constructed his heavily armed flagship the scimitar. ,015c99b411cef291d31cd5543c7ae957edebe6b4, after many years  shinzon became a leader of the remans  and constructed his heavily armed flagship  the scimitar. 
015c99b411cef291d31cd5543c7ae957edebe6b4, what does shinzon need in order to stop rapidly aging and save his life? ,015c99b411cef291d31cd5543c7ae957edebe6b4, dr. crusher discovers that shinzon is aging rapidly due to being a clone and the only possible means to stop it is a transfusion of picard s own blood. ,015c99b411cef291d31cd5543c7ae957edebe6b4, dr. crusher discovers that shinzon is aging rapidly due to being a clone and the only possible means to stop it is a transfusion of picard's own blood. 
015c99b411cef291d31cd5543c7ae957edebe6b4, who rescues picard from shinzon? ,015c99b411cef291d31cd5543c7ae957edebe6b4, shinzon kidnaps picard from the enterprise  as well as b 4  having planted the android on the nearby planet to lure picard to romulus. ,015c99b411cef291d31cd5543c7ae957edebe6b4, shinzon kidnaps picard from the enterprise as well as b 4 having planted the android on the nearby planet to lure picard to romulus. 
015c99b411cef291d31cd5543c7ae957edebe6b4, what planet is endangered by shinzon's plans to use the thalaron radiation generator? ,015c99b411cef291d31cd5543c7ae957edebe6b4, they have now seen enough of the scimitar to know that shinzon plans to use the warship to invade the federation using its thalaron radiation generator as a weapon with the eradication of all life on earth being his first priority. ,015c99b411cef291d31cd5543c7ae957edebe6b4, they have now seen enough of the scimitar to know that shinzon plans to use the warship to invade the federation using its thalaron radiation generator as a weapon  with the eradication of all life on earth being his first priority. 
015c99b411cef291d31cd5543c7ae957edebe6b4, who kills shinzon? ,015c99b411cef291d31cd5543c7ae957edebe6b4, two romulan warbirds come to the enterprise s aid  as they do not want to be complicit in shinzon s genocidal plans  but shinzon destroys one and disables the other. ,015c99b411cef291d31cd5543c7ae957edebe6b4, picard boards the scimitar to face shinzon alone  and eventually kills him by impaling him on a metal strut. 
015c99b411cef291d31cd5543c7ae957edebe6b4, who will become commander of the uss titan? ,015c99b411cef291d31cd5543c7ae957edebe6b4, picard bids farewell to newly promoted captain riker  who is off to command the uss titan  to begin a possible peace negotiation mission with the romulans. ,015c99b411cef291d31cd5543c7ae957edebe6b4, picard bids farewell to newly promoted captain riker who is off to command the uss titan to begin a possible peace negotiation mission with the romulans. 
015c99b411cef291d31cd5543c7ae957edebe6b4, why is shinzon aging rapidly? ,015c99b411cef291d31cd5543c7ae957edebe6b4, dr. crusher discovers that shinzon is aging rapidly due to being a clone and the only possible means to stop it is a transfusion of picard s own blood. ,015c99b411cef291d31cd5543c7ae957edebe6b4, dr. crusher discovers that shinzon is aging rapidly due to being a clone and the only possible means to stop it is a transfusion of picard's own blood. 
015c99b411cef291d31cd5543c7ae957edebe6b4, which person (other than himself) does shinzon most resemble? ,015c99b411cef291d31cd5543c7ae957edebe6b4, two romulan warbirds come to the enterprise s aid  as they do not want to be complicit in shinzon s genocidal plans  but shinzon destroys one and disables the other. ,015c99b411cef291d31cd5543c7ae957edebe6b4, a faction of the military is in support of shinzon  but the praetor and senate are set against it. 
015c99b411cef291d31cd5543c7ae957edebe6b4, what is detected by the enterprise when they travel through the kolaron planetary system? ,015c99b411cef291d31cd5543c7ae957edebe6b4, the enterprise returns to earth for repairs. ,015c99b411cef291d31cd5543c7ae957edebe6b4, the enterprise returns to earth for repairs. 
015c99b411cef291d31cd5543c7ae957edebe6b4, who does shinzon kidnap from the enterprise? ,015c99b411cef291d31cd5543c7ae957edebe6b4, two romulan warbirds come to the enterprise s aid  as they do not want to be complicit in shinzon s genocidal plans  but shinzon destroys one and disables the other. ,015c99b411cef291d31cd5543c7ae957edebe6b4, the enterprise returns to earth for repairs. 
015c99b411cef291d31cd5543c7ae957edebe6b4, what is the scimitar? ,015c99b411cef291d31cd5543c7ae957edebe6b4, the collision leaves both ships heavily damaged and destroys the scimitar's primary weapons. ,015c99b411cef291d31cd5543c7ae957edebe6b4, the collision leaves both ships heavily damaged and destroys the scimitar s primary weapons. 
015c99b411cef291d31cd5543c7ae957edebe6b4, why does shinzon activate the thalaron weapon? ,015c99b411cef291d31cd5543c7ae957edebe6b4, to assure their mutual destruction  shinzon activates the thalaron weapon. ,015c99b411cef291d31cd5543c7ae957edebe6b4, to assure their mutual destruction shinzon activates the thalaron weapon. 
015c99b411cef291d31cd5543c7ae957edebe6b4, how does shinzon die? ,015c99b411cef291d31cd5543c7ae957edebe6b4, on arrival  they learn shinzon is a clone of picard  secretly created by romulans to plant a high ranking spy into the federation  but the project was abandoned and shinzon left on remus as a child to die as a slave. ,015c99b411cef291d31cd5543c7ae957edebe6b4, on arrival they learn shinzon is a clone of picard secretly created by romulans to plant a high ranking spy into the federation but the project was abandoned and shinzon left on remus as a child to die as a slave. 
015c99b411cef291d31cd5543c7ae957edebe6b4, why does the enterprise travel to earth? ,015c99b411cef291d31cd5543c7ae957edebe6b4, the enterprise returns to earth for repairs. ,015c99b411cef291d31cd5543c7ae957edebe6b4, the enterprise returns to earth for repairs. 
015c99b411cef291d31cd5543c7ae957edebe6b4, how does dr. crusher treat shinzon? ,015c99b411cef291d31cd5543c7ae957edebe6b4, dr. crusher discovers that shinzon is aging rapidly due to being a clone and the only possible means to stop it is a transfusion of picard s own blood. ,015c99b411cef291d31cd5543c7ae957edebe6b4, dr. crusher discovers that shinzon is aging rapidly due to being a clone and the only possible means to stop it is a transfusion of picard's own blood. 
015c99b411cef291d31cd5543c7ae957edebe6b4, what do riker and troy hope to accomplish on betazed? ,015c99b411cef291d31cd5543c7ae957edebe6b4, meanwhile  the crew of the uss enterprise e prepares to bid farewell to first officer commander william riker and counselor deanna troi  who are being married on betazed. ,015c99b411cef291d31cd5543c7ae957edebe6b4, meanwhile the crew of the uss enterprise e prepares to bid farewell to first officer commander william riker and counselor deanna troi who are being married on betazed. 
019a9611dd8e1b822bd0a58f075cc4a30bdd0797, what is lisbeth's nickname? ,019a9611dd8e1b822bd0a58f075cc4a30bdd0797, at hoel lisbeth is cared for by kjersti hoel the farm's owner who has made a promise to lisbeth's mother before she died. ,019a9611dd8e1b822bd0a58f075cc4a30bdd0797, her brother  jacob  also goes to nordrum farm to become a herdsman there. 
019a9611dd8e1b822bd0a58f075cc4a30bdd0797, how did lisbeth get her long skirt? ,019a9611dd8e1b822bd0a58f075cc4a30bdd0797, at hoel  lisbeth is cared for by kjersti hoel  the farm s owner  who has made a promise to lisbeth s mother before she died. ,019a9611dd8e1b822bd0a58f075cc4a30bdd0797, after her mother's death lisbeth (given the nickname longskirt or sidsăśrk in the original norwegian because of her much too long skirt a christmas present given her by her brother) as she moves from her original home at new ridge farm (called peerout castle for its fine view of the valley) to hoel farm one of the central farms of the area. 
019a9611dd8e1b822bd0a58f075cc4a30bdd0797, what is lisbeth's job on the farm? ,019a9611dd8e1b822bd0a58f075cc4a30bdd0797, at hoel lisbeth is cared for by kjersti hoel the farm's owner who has made a promise to lisbeth's mother before she died. ,019a9611dd8e1b822bd0a58f075cc4a30bdd0797, her brother jacob also goes to nordrum farm to become a herdsman there. 
019a9611dd8e1b822bd0a58f075cc4a30bdd0797, what is jacob's relationship to lisbeth? ,019a9611dd8e1b822bd0a58f075cc4a30bdd0797, at hoel  lisbeth is cared for by kjersti hoel  the farm s owner  who has made a promise to lisbeth s mother before she died. ,019a9611dd8e1b822bd0a58f075cc4a30bdd0797, her brother jacob also goes to nordrum farm to become a herdsman there. 
019a9611dd8e1b822bd0a58f075cc4a30bdd0797, how did lisbeth get her nickname? ,019a9611dd8e1b822bd0a58f075cc4a30bdd0797, at hoel  lisbeth is cared for by kjersti hoel  the farm s owner  who has made a promise to lisbeth s mother before she died. ,019a9611dd8e1b822bd0a58f075cc4a30bdd0797, at the seter lisbeth meets two other herdsmen from neighboring farms and spends the summer with them getting to know them as she grows up. 
