question_id,question,answer1_id,answer1,answer2_id,answer2
0207a55a2d507f3b4feb99b227751b76f88ddd53, why doesn't chuck and kelly get married? ,0207a55a2d507f3b4feb99b227751b76f88ddd53, kelly gives chuck the keys to the car they once shared. ,0207a55a2d507f3b4feb99b227751b76f88ddd53, kelly gives chuck the keys to the car they once shared. 
0207a55a2d507f3b4feb99b227751b76f88ddd53, how does chuck end up on an island? ,0207a55a2d507f3b4feb99b227751b76f88ddd53, kelly gives chuck the keys to the car they once shared. ,0207a55a2d507f3b4feb99b227751b76f88ddd53, kelly gives chuck the keys to the car they once shared. 
0207a55a2d507f3b4feb99b227751b76f88ddd53, what are some changes chuck goes through after four years on the island? ,0207a55a2d507f3b4feb99b227751b76f88ddd53, kelly gives chuck the keys to the car they once shared. ,0207a55a2d507f3b4feb99b227751b76f88ddd53, kelly gives chuck the keys to the car they once shared. 
0207a55a2d507f3b4feb99b227751b76f88ddd53, which package does chuck leave unopened? ,0207a55a2d507f3b4feb99b227751b76f88ddd53, he leaves one package with a pair of angel wings stenciled on it unopened. ,0207a55a2d507f3b4feb99b227751b76f88ddd53, he leaves one package  with a pair of angel wings stenciled on it  unopened. 
0207a55a2d507f3b4feb99b227751b76f88ddd53, what is wilson? ,0207a55a2d507f3b4feb99b227751b76f88ddd53, in anger and pain he throws several objects including a wilson volleyball from one of the packages. ,0207a55a2d507f3b4feb99b227751b76f88ddd53, in anger and pain  he throws several objects  including a wilson volleyball from one of the packages. 
0207a55a2d507f3b4feb99b227751b76f88ddd53, what does he find out after getting rescued and returning home? ,4b30ab1c49b62dc59b9773954958d9ac6807a865, initially  it appears that the children are rescued. ,4b30ab1c49b62dc59b9773954958d9ac6807a865, initially it appears that the children are rescued. 
0207a55a2d507f3b4feb99b227751b76f88ddd53, who does chuch return the angel wing package to? ,0207a55a2d507f3b4feb99b227751b76f88ddd53, he leaves one package with a pair of angel wings stenciled on it unopened. ,0207a55a2d507f3b4feb99b227751b76f88ddd53, he leaves one package  with a pair of angel wings stenciled on it  unopened. 
0207a55a2d507f3b4feb99b227751b76f88ddd53, how does chuck wound his hand? ,0207a55a2d507f3b4feb99b227751b76f88ddd53, during a first attempt to make fire  chuck receives a deep wound to his hand. ,0207a55a2d507f3b4feb99b227751b76f88ddd53, during a first attempt to make fire chuck receives a deep wound to his hand. 
0207a55a2d507f3b4feb99b227751b76f88ddd53, what does kelly give chuck when he returns to civilization? ,0207a55a2d507f3b4feb99b227751b76f88ddd53, kelly gives chuck the keys to the car they once shared. ,0207a55a2d507f3b4feb99b227751b76f88ddd53, kelly gives chuck the keys to the car they once shared. 
0207a55a2d507f3b4feb99b227751b76f88ddd53, what washes up on the island that helps chuck complete the construction of his raft? ,0207a55a2d507f3b4feb99b227751b76f88ddd53, a large section from a portable toilet washes up on the island ; chuck uses it as a sail in the construction of a raft. ,0207a55a2d507f3b4feb99b227751b76f88ddd53, a large section from a portable toilet washes up on the island; chuck uses it as a sail in the construction of a raft. 
0207a55a2d507f3b4feb99b227751b76f88ddd53, where do chuck and kelly live? ,0207a55a2d507f3b4feb99b227751b76f88ddd53, kelly gives chuck the keys to the car they once shared. ,0207a55a2d507f3b4feb99b227751b76f88ddd53, kelly gives chuck the keys to the car they once shared. 
0207a55a2d507f3b4feb99b227751b76f88ddd53, where is chuck called away to during christmas? ,0207a55a2d507f3b4feb99b227751b76f88ddd53, a christmas with relatives is interrupted when chuck is summoned to resolve a problem in malaysia. ,0207a55a2d507f3b4feb99b227751b76f88ddd53, a christmas with relatives is interrupted when chuck is summoned to resolve a problem in malaysia. 
0207a55a2d507f3b4feb99b227751b76f88ddd53, what is the company that chuck works for? ,0207a55a2d507f3b4feb99b227751b76f88ddd53, kelly gives chuck the keys to the car they once shared. ,0207a55a2d507f3b4feb99b227751b76f88ddd53, kelly gives chuck the keys to the car they once shared. 
0207a55a2d507f3b4feb99b227751b76f88ddd53, what does chuck collect along the shore of the island he has landed on? ,0207a55a2d507f3b4feb99b227751b76f88ddd53, upon returning to civilization chuck learns that he has long been given up for dead; his family and acquaintances have held a funeral and kelly has since married chuck's one time endodontist and has a daughter. ,0207a55a2d507f3b4feb99b227751b76f88ddd53, upon returning to civilization  chuck learns that he has long been given up for dead ; his family and acquaintances have held a funeral  and kelly has since married chuck s one time endodontist and has a daughter. 
0207a55a2d507f3b4feb99b227751b76f88ddd53, what sports item does chuck leave a bloody hand print on? ,0207a55a2d507f3b4feb99b227751b76f88ddd53, a short time later he draws a face in the bloody hand print on the ball  names it wilson  and begins talking to it. ,0207a55a2d507f3b4feb99b227751b76f88ddd53, a short time later he draws a face in the bloody hand print on the ball names it wilson and begins talking to it. 
0207a55a2d507f3b4feb99b227751b76f88ddd53, who is the only friend chuck talks to on the island? ,0207a55a2d507f3b4feb99b227751b76f88ddd53, kelly gives chuck the keys to the car they once shared. ,0207a55a2d507f3b4feb99b227751b76f88ddd53, kelly gives chuck the keys to the car they once shared. 
0207a55a2d507f3b4feb99b227751b76f88ddd53, why can kelly and chuck not be together when he returns? ,0207a55a2d507f3b4feb99b227751b76f88ddd53, kelly gives chuck the keys to the car they once shared. ,0207a55a2d507f3b4feb99b227751b76f88ddd53, kelly gives chuck the keys to the car they once shared. 
0207a55a2d507f3b4feb99b227751b76f88ddd53, where does chuck go to deliver the last package he saved from the crash? ,0207a55a2d507f3b4feb99b227751b76f88ddd53, the house at the address is empty  so he leaves the package at the door with a note saying that the package saved his life. ,0207a55a2d507f3b4feb99b227751b76f88ddd53, the house at the address is empty so he leaves the package at the door with a note saying that the package saved his life. 
0207a55a2d507f3b4feb99b227751b76f88ddd53, what is the symbol on the package and on the back of the woman's truck? ,0207a55a2d507f3b4feb99b227751b76f88ddd53, the house at the address is empty so he leaves the package at the door with a note saying that the package saved his life. ,0207a55a2d507f3b4feb99b227751b76f88ddd53, the house at the address is empty  so he leaves the package at the door with a note saying that the package saved his life. 
02476285f0673b06c7754deed4517e54c50c42b5, which of mrs. tabitha twitchit's children become the best at catching rats? ,02476285f0673b06c7754deed4517e54c50c42b5, tom kitten is a young cat who lives with his mother mrs. tabitha twitchit and sisters moppet and mittens in a house overrun with rats. ,02476285f0673b06c7754deed4517e54c50c42b5, tom kitten is a young cat who lives with his mother  mrs. tabitha twitchit  and sisters  moppet and mittens  in a house overrun with rats. 
02476285f0673b06c7754deed4517e54c50c42b5, what kind of food did the rats put on tom kitten? ,02476285f0673b06c7754deed4517e54c50c42b5, tom kitten is a young cat who lives with his mother mrs. tabitha twitchit and sisters moppet and mittens in a house overrun with rats. ,02476285f0673b06c7754deed4517e54c50c42b5, tom kitten is a young cat who lives with his mother  mrs. tabitha twitchit  and sisters  moppet and mittens  in a house overrun with rats. 
02476285f0673b06c7754deed4517e54c50c42b5, how did tom escape from the cupboard? ,02476285f0673b06c7754deed4517e54c50c42b5, her children being an unruly bunch  mrs. twitchit puts moppet and mittens in a cupboard in order to keep them under control  but tom kitten escapes up the chimney. ,02476285f0673b06c7754deed4517e54c50c42b5, her children being an unruly bunch mrs. twitchit puts moppet and mittens in a cupboard in order to keep them under control but tom kitten escapes up the chimney. 
02476285f0673b06c7754deed4517e54c50c42b5, what were the names of the rats that captured tom? ,02476285f0673b06c7754deed4517e54c50c42b5, tom is so affected by the incident that while his sisters become fine rat catchers he is afraid of anything larger than a mouse. ,02476285f0673b06c7754deed4517e54c50c42b5, there he meets the rats mr. samuel whiskers and his wife anna maria. 
02476285f0673b06c7754deed4517e54c50c42b5, who helped mrs. twitchit find tom when he was lost? ,02476285f0673b06c7754deed4517e54c50c42b5, tom kitten is a young cat who lives with his mother mrs. tabitha twitchit and sisters moppet and mittens in a house overrun with rats. ,02476285f0673b06c7754deed4517e54c50c42b5, tom kitten is a young cat who lives with his mother  mrs. tabitha twitchit  and sisters  moppet and mittens  in a house overrun with rats. 
02476285f0673b06c7754deed4517e54c50c42b5, where did tom become stuck after trying to escape? ,02476285f0673b06c7754deed4517e54c50c42b5, they quickly call for john joiner  the carpenter  who saws open the floor and rescues tom. ,02476285f0673b06c7754deed4517e54c50c42b5, they quickly call for john joiner the carpenter who saws open the floor and rescues tom. 
02476285f0673b06c7754deed4517e54c50c42b5, who is the carpenter that came to help get tom out of the attic? ,02476285f0673b06c7754deed4517e54c50c42b5, they quickly call for john joiner  the carpenter  who saws open the floor and rescues tom. ,02476285f0673b06c7754deed4517e54c50c42b5, they quickly call for john joiner the carpenter who saws open the floor and rescues tom. 
02476285f0673b06c7754deed4517e54c50c42b5, why was the floor to the attic cut open? ,3b2427be8d3bbfe55590d1ce307f778ede5bbcd9, larry cuts his hand carrying a bed up the stairs  and lets his blood drip on the attic floor. ,3b2427be8d3bbfe55590d1ce307f778ede5bbcd9, larry cuts his hand carrying a bed up the stairs and lets his blood drip on the attic floor. 
02476285f0673b06c7754deed4517e54c50c42b5, where do the rats escape to after they are caught? ,02476285f0673b06c7754deed4517e54c50c42b5, there he meets the rats mr. samuel whiskers and his wife anna maria. ,02476285f0673b06c7754deed4517e54c50c42b5, there he meets the rats  mr. samuel whiskers and his wife anna maria. 
02476285f0673b06c7754deed4517e54c50c42b5, what were the rats planning on doing to tom? ,02476285f0673b06c7754deed4517e54c50c42b5, tom is so affected by the incident that while his sisters become fine rat catchers he is afraid of anything larger than a mouse. ,02476285f0673b06c7754deed4517e54c50c42b5, there he meets the rats  mr. samuel whiskers and his wife anna maria. 
02476285f0673b06c7754deed4517e54c50c42b5, who are moppet and mittens to tom kitten? ,02476285f0673b06c7754deed4517e54c50c42b5, tom kitten is a young cat who lives with his mother mrs. tabitha twitchit and sisters moppet and mittens in a house overrun with rats. ,02476285f0673b06c7754deed4517e54c50c42b5, tom kitten is a young cat who lives with his mother  mrs. tabitha twitchit  and sisters  moppet and mittens  in a house overrun with rats. 
02476285f0673b06c7754deed4517e54c50c42b5, why did mrs. tabitha twitchit put her children in the cupboard? ,02476285f0673b06c7754deed4517e54c50c42b5, her children being an unruly bunch  mrs. twitchit puts moppet and mittens in a cupboard in order to keep them under control  but tom kitten escapes up the chimney. ,02476285f0673b06c7754deed4517e54c50c42b5, her children being an unruly bunch mrs. twitchit puts moppet and mittens in a cupboard in order to keep them under control but tom kitten escapes up the chimney. 
02476285f0673b06c7754deed4517e54c50c42b5, where did tom kittens end up after escaping through the chimney? ,02476285f0673b06c7754deed4517e54c50c42b5, her children being an unruly bunch  mrs. twitchit puts moppet and mittens in a cupboard in order to keep them under control  but tom kitten escapes up the chimney. ,02476285f0673b06c7754deed4517e54c50c42b5, her children being an unruly bunch mrs. twitchit puts moppet and mittens in a cupboard in order to keep them under control but tom kitten escapes up the chimney. 
02476285f0673b06c7754deed4517e54c50c42b5, who did tom kittens meet in the attic? ,02476285f0673b06c7754deed4517e54c50c42b5, tom kitten is a young cat who lives with his mother  mrs. tabitha twitchit  and sisters  moppet and mittens  in a house overrun with rats. ,02476285f0673b06c7754deed4517e54c50c42b5, tom kitten is a young cat who lives with his mother mrs. tabitha twitchit and sisters moppet and mittens in a house overrun with rats. 
02476285f0673b06c7754deed4517e54c50c42b5, what did samuel whiskers and anna maria want to do to tom kittens? ,02476285f0673b06c7754deed4517e54c50c42b5, there he meets the rats mr. samuel whiskers and his wife anna maria. ,02476285f0673b06c7754deed4517e54c50c42b5, there he meets the rats  mr. samuel whiskers and his wife anna maria. 
02476285f0673b06c7754deed4517e54c50c42b5, who rescued tom kittens? ,02476285f0673b06c7754deed4517e54c50c42b5, tom kitten is a young cat who lives with his mother mrs. tabitha twitchit and sisters moppet and mittens in a house overrun with rats. ,02476285f0673b06c7754deed4517e54c50c42b5, tom kitten is a young cat who lives with his mother  mrs. tabitha twitchit  and sisters  moppet and mittens  in a house overrun with rats. 
02476285f0673b06c7754deed4517e54c50c42b5, how was tom kittens rescued? ,02476285f0673b06c7754deed4517e54c50c42b5, tom kitten is a young cat who lives with his mother  mrs. tabitha twitchit  and sisters  moppet and mittens  in a house overrun with rats. ,02476285f0673b06c7754deed4517e54c50c42b5, tom kitten is a young cat who lives with his mother mrs. tabitha twitchit and sisters moppet and mittens in a house overrun with rats. 
02476285f0673b06c7754deed4517e54c50c42b5, where did samuel whiskers and anna maria escape to? ,02476285f0673b06c7754deed4517e54c50c42b5, there he meets the rats mr. samuel whiskers and his wife anna maria. ,02476285f0673b06c7754deed4517e54c50c42b5, there he meets the rats  mr. samuel whiskers and his wife anna maria. 
02476285f0673b06c7754deed4517e54c50c42b5, how was tom kittens affected by the incident with the rats? ,02476285f0673b06c7754deed4517e54c50c42b5, tom is so affected by the incident that while his sisters become fine rat catchers he is afraid of anything larger than a mouse. ,02476285f0673b06c7754deed4517e54c50c42b5, tom is so affected by the incident that while his sisters become fine rat catchers he is afraid of anything larger than a mouse.the theme of the tale is the childhood sin of disobedience. 
02476285f0673b06c7754deed4517e54c50c42b5, how many children does mrs. twitchit have? ,02476285f0673b06c7754deed4517e54c50c42b5, her children being an unruly bunch  mrs. twitchit puts moppet and mittens in a cupboard in order to keep them under control  but tom kitten escapes up the chimney. ,02476285f0673b06c7754deed4517e54c50c42b5, her children being an unruly bunch mrs. twitchit puts moppet and mittens in a cupboard in order to keep them under control but tom kitten escapes up the chimney. 
02476285f0673b06c7754deed4517e54c50c42b5, what are the names of tom's sisters? ,02476285f0673b06c7754deed4517e54c50c42b5, tom is so affected by the incident that while his sisters become fine rat catchers he is afraid of anything larger than a mouse. ,02476285f0673b06c7754deed4517e54c50c42b5, tom kitten is a young cat who lives with his mother  mrs. tabitha twitchit  and sisters  moppet and mittens  in a house overrun with rats. 
02476285f0673b06c7754deed4517e54c50c42b5, what animals have overun mrs. twitchit's house? ,02476285f0673b06c7754deed4517e54c50c42b5, there he meets the rats mr. samuel whiskers and his wife anna maria. ,02476285f0673b06c7754deed4517e54c50c42b5, there he meets the rats  mr. samuel whiskers and his wife anna maria. 
02476285f0673b06c7754deed4517e54c50c42b5, where does mrs. twitchit place moppet and mittens? ,02476285f0673b06c7754deed4517e54c50c42b5, tom kitten is a young cat who lives with his mother  mrs. tabitha twitchit  and sisters  moppet and mittens  in a house overrun with rats. ,02476285f0673b06c7754deed4517e54c50c42b5, tom kitten is a young cat who lives with his mother mrs. tabitha twitchit and sisters moppet and mittens in a house overrun with rats. 
02476285f0673b06c7754deed4517e54c50c42b5, where does tom kitten hide? ,02476285f0673b06c7754deed4517e54c50c42b5, tom kitten is a young cat who lives with his mother mrs. tabitha twitchit and sisters moppet and mittens in a house overrun with rats. ,02476285f0673b06c7754deed4517e54c50c42b5, tom kitten is a young cat who lives with his mother  mrs. tabitha twitchit  and sisters  moppet and mittens  in a house overrun with rats. 
02476285f0673b06c7754deed4517e54c50c42b5, what do the rats plan to do with tom? ,02476285f0673b06c7754deed4517e54c50c42b5, tom is so affected by the incident that while his sisters become fine rat catchers he is afraid of anything larger than a mouse. ,02476285f0673b06c7754deed4517e54c50c42b5, there he meets the rats mr. samuel whiskers and his wife anna maria. 
02476285f0673b06c7754deed4517e54c50c42b5, what ingredients do the rats cover tom with? ,02476285f0673b06c7754deed4517e54c50c42b5, tom is so affected by the incident that while his sisters become fine rat catchers he is afraid of anything larger than a mouse. ,02476285f0673b06c7754deed4517e54c50c42b5, there he meets the rats  mr. samuel whiskers and his wife anna maria. 
02476285f0673b06c7754deed4517e54c50c42b5, where do sam whiskers and anna maria escape to? ,02476285f0673b06c7754deed4517e54c50c42b5, there he meets the rats mr. samuel whiskers and his wife anna maria. ,02476285f0673b06c7754deed4517e54c50c42b5, there he meets the rats  mr. samuel whiskers and his wife anna maria. 
02476285f0673b06c7754deed4517e54c50c42b5, what do moppet and mittens become afterwards? ,02476285f0673b06c7754deed4517e54c50c42b5, tom kitten is a young cat who lives with his mother mrs. tabitha twitchit and sisters moppet and mittens in a house overrun with rats. ,02476285f0673b06c7754deed4517e54c50c42b5, tom kitten is a young cat who lives with his mother  mrs. tabitha twitchit  and sisters  moppet and mittens  in a house overrun with rats. 
02476285f0673b06c7754deed4517e54c50c42b5," ""what kind of a sin do tom ",02476285f0673b06c7754deed4517e54c50c42b5, the theme of the tale is the childhood sin of disobedience. ,02476285f0673b06c7754deed4517e54c50c42b5, tom is so affected by the incident that while his sisters become fine rat catchers he is afraid of anything larger than a mouse.the theme of the tale is the childhood sin of disobedience. 
026723e23a4f1b279e20d9d2d3746a1dc4543b2d, upon whose arrival does minna finally tell the truth about her finances? ,026723e23a4f1b279e20d9d2d3746a1dc4543b2d, only when tellheim is reduced to the verge of despair and the belated arrival of minna s uncle and guardian threatens to give the whole thing away does minna relent and reveal the truth. ,026723e23a4f1b279e20d9d2d3746a1dc4543b2d, only when tellheim is reduced to the verge of despair and the belated arrival of minna's uncle and guardian threatens to give the whole thing away does minna relent and reveal the truth. 
026723e23a4f1b279e20d9d2d3746a1dc4543b2d, what does the delayed letter from the king announce? ,026723e23a4f1b279e20d9d2d3746a1dc4543b2d, at this point a delayed letter from the king is delivered. ,026723e23a4f1b279e20d9d2d3746a1dc4543b2d, at this point a delayed letter from the king is delivered. 
026723e23a4f1b279e20d9d2d3746a1dc4543b2d, why does minna pretend to be penniless and in dire straits? ,026723e23a4f1b279e20d9d2d3746a1dc4543b2d, when no argument can move him minna with the help of her maid franziska pretends that she too is penniless and in dire straits. ,026723e23a4f1b279e20d9d2d3746a1dc4543b2d, when no argument can move him  minna with the help of her maid  franziska  pretends that she  too  is penniless and in dire straits. 
026723e23a4f1b279e20d9d2d3746a1dc4543b2d, who is minna von barnhelm's missing lover? ,026723e23a4f1b279e20d9d2d3746a1dc4543b2d, the lady minna von barnhelm recognizes the ring as one of the betrothal rings which she and tellheim had exchanged and is overjoyed that her search for her missing lover is ended. ,026723e23a4f1b279e20d9d2d3746a1dc4543b2d, the lady  minna von barnhelm  recognizes the ring as one of the betrothal rings which she and tellheim had exchanged  and is overjoyed that her search for her missing lover is ended. 
026723e23a4f1b279e20d9d2d3746a1dc4543b2d, what is tellheim's last possession of worth? ,026723e23a4f1b279e20d9d2d3746a1dc4543b2d, during tellheim's absence from the inn the landlord has caused tellheim's effects to be removed ostensibly because his rooms were needed for a lady and her maid. ,026723e23a4f1b279e20d9d2d3746a1dc4543b2d, werner knowing tellheim's predicament is in hope that he will use the money as his own. 
026723e23a4f1b279e20d9d2d3746a1dc4543b2d, what is the name of tellheim's servant? ,026723e23a4f1b279e20d9d2d3746a1dc4543b2d, during tellheim's absence from the inn the landlord has caused tellheim's effects to be removed ostensibly because his rooms were needed for a lady and her maid. ,026723e23a4f1b279e20d9d2d3746a1dc4543b2d, werner knowing tellheim's predicament is in hope that he will use the money as his own. 
026723e23a4f1b279e20d9d2d3746a1dc4543b2d, who left the sealed envelope for tellheim? ,026723e23a4f1b279e20d9d2d3746a1dc4543b2d, in the removal of the major's possessions the landlord comes upon a sealed envelope marked as containing five hundred thalers. ,026723e23a4f1b279e20d9d2d3746a1dc4543b2d, in the removal of the major s possessions  the landlord comes upon a sealed envelope marked as containing five hundred thalers. 
026723e23a4f1b279e20d9d2d3746a1dc4543b2d, what does the sealed envelope the landlord finds among tellheim's possessions contain? ,026723e23a4f1b279e20d9d2d3746a1dc4543b2d, in the removal of the major's possessions the landlord comes upon a sealed envelope marked as containing five hundred thalers. ,026723e23a4f1b279e20d9d2d3746a1dc4543b2d, in the removal of the major s possessions  the landlord comes upon a sealed envelope marked as containing five hundred thalers. 
026723e23a4f1b279e20d9d2d3746a1dc4543b2d, what army was major von tellheim dishonourably discharged from? ,026723e23a4f1b279e20d9d2d3746a1dc4543b2d, wounded and dishonourably discharged from the prussian army major von tellheim finds himself waiting at a berlin hotel with his servant for the outcome of his trial threatened by financial troubles and serious bribery allegations. ,026723e23a4f1b279e20d9d2d3746a1dc4543b2d, in a final scene of celebration matters are settled to the satisfaction of everyone including franziska and paul werner who have discovered a lively interest in each other.wounded and dishonourably discharged from the prussian army  major von tellheim finds himself waiting at a berlin hotel with his servant for the outcome of his trial  threatened by financial troubles and serious bribery allegations. 
026723e23a4f1b279e20d9d2d3746a1dc4543b2d, what war precedes the events which take place? ,23fa36d9def95414a50968d216460d52f3dd3653, octavia tells antony the war will stop when he returns to his rightful place  by her side. ,23fa36d9def95414a50968d216460d52f3dd3653, octavia tells antony the war will stop when he returns to his rightful place by her side. 
026723e23a4f1b279e20d9d2d3746a1dc4543b2d, why did major von tellheim leave the prussian army? ,026723e23a4f1b279e20d9d2d3746a1dc4543b2d, wounded and dishonourably discharged from the prussian army major von tellheim finds himself waiting at a berlin hotel with his servant for the outcome of his trial threatened by financial troubles and serious bribery allegations. ,026723e23a4f1b279e20d9d2d3746a1dc4543b2d, in a final scene of celebration matters are settled to the satisfaction of everyone including franziska and paul werner who have discovered a lively interest in each other.wounded and dishonourably discharged from the prussian army  major von tellheim finds himself waiting at a berlin hotel with his servant for the outcome of his trial  threatened by financial troubles and serious bribery allegations. 
026723e23a4f1b279e20d9d2d3746a1dc4543b2d, how much money does the marked sealed envelope the landlord finds claim to have? ,026723e23a4f1b279e20d9d2d3746a1dc4543b2d, in the removal of the major's possessions the landlord comes upon a sealed envelope marked as containing five hundred thalers. ,026723e23a4f1b279e20d9d2d3746a1dc4543b2d, in the removal of the major s possessions  the landlord comes upon a sealed envelope marked as containing five hundred thalers. 
026723e23a4f1b279e20d9d2d3746a1dc4543b2d, who left the money with the major? ,026723e23a4f1b279e20d9d2d3746a1dc4543b2d, what he does not know is that the money has been left with the major by paul werner his former sergeant. ,026723e23a4f1b279e20d9d2d3746a1dc4543b2d, what he does not know is that the money has been left with the major by paul werner  his former sergeant. 
026723e23a4f1b279e20d9d2d3746a1dc4543b2d, why does tellheim not want to use the money werner leaves for him? ,026723e23a4f1b279e20d9d2d3746a1dc4543b2d, werner knowing tellheim s predicament is in hope that he will use the money as his own. ,026723e23a4f1b279e20d9d2d3746a1dc4543b2d, what he does not know is that the money has been left with the major by paul werner  his former sergeant. 
